ZibName,ConceptID_2017,ConceptName_2017,Codelists_2017,Change,ConceptID_2020,ConceptName_2020,Codelists_2020,Bits,Omschrijving,TypeChange,Impact_heen,TRANSLATIE_spec_heen,Impact_terug,TRANSLATIE_spec_terug
Woonsituatie,NL-CM:7.8.1,Woonsituatie,,groen: geen wijzigingen,NL-CM:7.8.1,Woonsituatie,,,,NO CHANGE,,,,
Woonsituatie,NL-CM:7.8.2,Toelichting,,groen: geen wijzigingen,NL-CM:7.8.2,Toelichting,,,,NO CHANGE,,,,
Woonsituatie,NL-CM:7.8.3,WoningType,WoningTypeCodelijst,oranje: minor change,NL-CM:7.8.3,WoningType,WoningTypeCodelijst,ZIB-653 ; ZIB-1100 ; ZIB-810 ; ZIB769,Codelijst aangepast met meerdere aanpassingen,VALUESET CHANGES,Low,valuesets 2017 -> valueset 2020 regel,Medium,valuesets 2017 <- valueset 2020 regel
Woonsituatie,NL-CM:7.8.4,**concept toegevoegd in 2020**,,rood: major change,NL-CM:7.8.4,WoonOmstandigheid,WoonOmstandigheidCodelijst,ZIB-694,"Aan het model twee elementen toegevoegd, WoningAanpassing en WoonOmstandigheid.",CONCEPT ADDITION,Low,,High,IF [blank]source->target ELSE [toon en stuur de inhoud van dit data item als vrije tekst naar een 2017 ontvanger]
Woonsituatie,NL-CM:7.8.5,**concept toegevoegd in 2020**,,rood: major change,NL-CM:7.8.5,WoningAanpassing,WoningAanpassingCodelijst,ZIB-694,"Aan het model twee elementen toegevoegd, WoningAanpassing en WoonOmstandigheid.",CONCEPT ADDITION,Low,,High,IF [blank]source->target ELSE [toon en stuur de inhoud van dit data item als vrije tekst naar een 2017 ontvanger]
